{
  "protocol": "upa/1",
  "session": "s-inspect",
  "seq": 8,
  "game_s": 14.75,
  "wall_utc": "2026-10-26T18:00:08Z",
  "type": "inspection",
  "stage": "fields",
  "in_reply_to": 7,
  "data": {
    "time_unit": "seconds",
    "frame": 1234,
    "real_time_s": 42.5,
    "game_time_s": 12.25,
    "game_objects": [
      {
        "id": "scene:Assets/Scenes/Main.unity@0::0",
        "scene_id": "scene:Assets/Scenes/Main.unity@0",
        "scene_path": "Assets/Scenes/Main.unity",
        "parent_id": null,
        "name": "ExampleRoot",
        "path": "ExampleRoot",
        "sibling_index": 0,
        "depth": 0,
        "active_self": true,
        "active_in_hierarchy": true,
        "is_static": false,
        "component_count": 1,
        "components_returned": 1,
        "components_complete": true,
        "missing_component_count": 0
      }
    ],
    "fields": [
      {
        "id": "scene:Assets/Scenes/Main.unity@0::0::component:0::field:Assembly-CSharp::Example.Behaviour::value",
        "component_id": "scene:Assets/Scenes/Main.unity@0::0::component:0",
        "object_id": "scene:Assets/Scenes/Main.unity@0::0",
        "scene_id": "scene:Assets/Scenes/Main.unity@0",
        "name": "value",
        "declaring_assembly": "Assembly-CSharp",
        "declaring_type": "Example.Behaviour",
        "declaration_id": "Assembly-CSharp:Example.Behaviour:value",
        "field_type": "System.Int32",
        "field_type_assembly": "System.Private.CoreLib",
        "field_type_kind": "primitive",
        "visibility": "private",
        "is_static": false,
        "is_readonly": false,
        "is_literal": false,
        "compiler_generated": false,
        "serialize_field": true,
        "non_serialized": false,
        "serialize_reference": false,
        "hide_in_inspector": false,
        "serialized": true,
        "formerly_serialized_as": [],
        "value_state": "present",
        "value_kind": "integer",
        "value": 7,
        "is_null": false,
        "destroyed": false,
        "value_length": null,
        "value_truncated": null,
        "enum_name": null,
        "read_error": null,
        "binding_count": null,
        "bindings_returned": 0,
        "bindings_complete": null
      },
      {
        "id": "scene:Assets/Scenes/Main.unity@0::0::component:0::field:Assembly-CSharp::Example.Behaviour::unreadable",
        "component_id": "scene:Assets/Scenes/Main.unity@0::0::component:0",
        "object_id": "scene:Assets/Scenes/Main.unity@0::0",
        "scene_id": "scene:Assets/Scenes/Main.unity@0",
        "name": "unreadable",
        "declaring_assembly": "Assembly-CSharp",
        "declaring_type": "Example.Behaviour",
        "declaration_id": "Assembly-CSharp:Example.Behaviour:unreadable",
        "field_type": "System.Object",
        "field_type_assembly": "System.Private.CoreLib",
        "field_type_kind": "unsupported",
        "visibility": "private",
        "is_static": false,
        "is_readonly": false,
        "is_literal": false,
        "compiler_generated": false,
        "serialize_field": false,
        "non_serialized": false,
        "serialize_reference": false,
        "hide_in_inspector": false,
        "serialized": false,
        "formerly_serialized_as": [],
        "value_state": "error",
        "value_kind": "error",
        "value": null,
        "is_null": null,
        "destroyed": null,
        "value_length": null,
        "value_truncated": null,
        "enum_name": null,
        "read_error": "TargetException: field read failed",
        "binding_count": null,
        "bindings_returned": 0,
        "bindings_complete": null
      }
    ]
  },
  "caps": {
    "game_objects": {
      "limit": 100000,
      "observed": 1,
      "returned": 1,
      "truncated": false
    },
    "fields": {
      "limit": 30000,
      "observed": 2,
      "returned": 2,
      "truncated": false
    }
  },
  "errors": [
    "field scene:Assets/Scenes/Main.unity@0::0::component:0::field:Assembly-CSharp::Example.Behaviour::unreadable: read: TargetException: field read failed"
  ]
}
